id,title,year,authors,venue,entityUrl
646,Processing complex aggregate queries over data streams,2002,"Alin Dobra, Minos Garofalakis, Johannes Gehrke, Rajeev Rastogi",International Conference on Management of Data,564699
647,Continuously adaptive continuous queries over streams,2002,"Samuel Madden, Mehul Shah, Joseph M. Hellerstein, Vijayshankar Raman",International Conference on Management of Data,564698
648,Reports,2002,Avigdor Gal,ACM SIGMOD Record,507365
649,Reminiscences on influential papers,2002,Kenneth A. Ross,ACM SIGMOD Record,507364
650,Influential papers,2002,Ken Ross,ACM SIGMOD Record,507363
651,Too much middleware,2002,Michael Stonebraker,ACM SIGMOD Record,507362
652,Why I like working in academia,2002,Richard Thomas Snodgrass,ACM SIGMOD Record,507369
653,Career forum,2002,Alexandros Labrinidis,ACM SIGMOD Record,507368
654,Advances in databases and information systems: report of 5th East European Conference ADBIS'2001,2002,"Albertas Caplinskas, Johann Eder, Olegas Vasilecas",ACM SIGMOD Record,507367
655,Report on the 18th British National Conference on Databases (BNCOD),2002,"Carole Goble, Brian Read",ACM SIGMOD Record,507366
656,What will be,2002,Michael Dertouzos,ACM SIGMOD Record,507356
657,Distinguished database profiles,2002,Marianne Winslett,ACM SIGMOD Record,507357
658,Databases and transaction processing: an application-oriented approach,2002,"Philip M. Lewis, Arthur Bernstein, Michael Kifer",ACM SIGMOD Record,507354
659,Data mining: practical machine learning tools and techniques with Java implementations,2002,"Ian H. Witten, Eibe Frank",ACM SIGMOD Record,507355
660,The XML typechecking problem,2002,Dan Suciu,ACM SIGMOD Record,507360
661,Industry perspective,2002,Len Seligman,ACM SIGMOD Record,507361
662,"Avi Silberschatz speaks out: on academia versus industrial labs, startup fever, database PhD quality, the future of data mining as a research area, IP issues, how he wouldn't change a thing, and more",2002,Marianne Winslett,ACM SIGMOD Record,507358
663,Database principles,2002,Leonid Libkin,ACM SIGMOD Record,507359
664,Business data management for business-to-business electronic commerce,2002,"Christoph Quix, Mareike Schoop, Manfred Jeusfeld",ACM SIGMOD Record,507348
665,A multi-agent system infrastructure for software component market-place: an ontological perspective,2002,"Riza Cenk Erdur, O&#287;uz Dikenelli",ACM SIGMOD Record,507349
666,Conceptual modeling and specification generation for B2B business processes based on ebXML,2002,HyoungDo Kim,ACM SIGMOD Record,507346
667,Semantic B2B integration: issues in ontology-based approaches,2002,"Zhan Cui, Dean Jones, Paul O'Brien",ACM SIGMOD Record,507347
668,Book reviews,2002,Karl Aberer,ACM SIGMOD Record,507352
669,Book review column,2002,Karl Aberer,ACM SIGMOD Record,507353
670,Supply chain infrastructures: system integration and information sharing,2002,"Michael O. Ball, Meng Ma, Louiqa Raschid, Zhengying Zhao",ACM SIGMOD Record,507350
671,The role of B2B engines in B2B integration architectures,2002,Christoph Bussler,ACM SIGMOD Record,507351
672,Clustering by pattern similarity in large data sets,2002,"Haixun Wang, Wei Wang, Jiong Yang, Philip S. Yu",International Conference on Management of Data,564737
673,General match: a subsequence matching method in time-series databases based on generalized windows,2002,"Yang-Sae Moon, Kyu-Young Whang, Wook-Shin Han",International Conference on Management of Data,564735
674,A Monte Carlo algorithm for fast projective clustering,2002,"Cecilia M. Procopiuc, Michael Jones, Pankaj K. Agarwal, T. M. Murali",International Conference on Management of Data,564739
675,Mining long sequential patterns in a noisy environment,2002,"Jiong Yang, Wei Wang, Philip S. Yu, Jiawei Han",International Conference on Management of Data,564738
676,Selectivity estimation for spatio-temporal queries to moving objects,2002,"Yong-Jin Choi, Chin-Wan Chung",International Conference on Management of Data,564742
677,Dynamic multidimensional histograms,2002,"Nitin Thaper, Sudipto Guha, Piotr Indyk, Nick Koudas",International Conference on Management of Data,564741
678,Dwarf: shrinking the PetaCube,2002,"Yannis Sismanis, Antonios Deligiannakis, Nick Roussopoulos, Yannis Kotidis",International Conference on Management of Data,564745
679,"Hierarchical subspace sampling: a unified framework for high dimensional data reduction, selectivity estimation and nearest neighbor search",2002,Charu C. Aggarwal,International Conference on Management of Data,564743
680,Efficient algorithms for minimizing tree pattern queries,2002,Prakash Ramanan,International Conference on Management of Data,564726
681,Approximate XML joins,2002,"Sudipto Guha, H. V. Jagadish, Nick Koudas, Divesh Srivastava, Ting Yu",International Conference on Management of Data,564725
682,Efficient k-NN search on vertically decomposed data,2002,"Arjen P. de Vries, Nikos Mamoulis, Niels Nes, Martin Kersten",International Conference on Management of Data,564729
683,Holistic twig joins: optimal XML pattern matching,2002,"Nicolas Bruno, Nick Koudas, Divesh Srivastava",International Conference on Management of Data,564727
684,Minimal probing: supporting expensive predicates for top-k queries,2002,"Kevin Chen-Chuan Chang, Seung-won Hwang",International Conference on Management of Data,564731
685,Time-parameterized queries in spatio-temporal databases,2002,"Yufei Tao, Dimitris Papadias",International Conference on Management of Data,564730
686,Continually evaluating similarity-based pattern queries on a streaming time series,2002,"Like Gao, X. Sean Wang",International Conference on Management of Data,564734
687,Statistical synopses for graph-structured XML databases,2002,"Neoklis Polyzotis, Minos Garofalakis",International Conference on Management of Data,564733
688,QURSED: querying and reporting semistructured data,2002,"Yannis Papakonstantinou, Michalis Petropoulos, Vasilis Vassalos",International Conference on Management of Data,564714
689,Storing and querying ordered XML using a relational database system,2002,"Igor Tatarinov, Stratis D. Viglas, Kevin Beyer, Jayavel Shanmugasundaram, Eugene Shekita, Chun Zhang",International Conference on Management of Data,564715
690,Executing SQL over encrypted data in the database-service-provider model,2002,"Hakan Hacig&#252;m&#252;&#351;, Bala Iyer, Chen Li, Sharad Mehrotra",International Conference on Management of Data,564717
691,Workflow management with service quality guarantees,2002,"Michael Gillmann, Gerhard Weikum, Wolfgang Wonner",International Conference on Management of Data,564718
692,"Mining database structure; or, how to build a data quality browser",2002,"Tamraparni Dasu, Theodore Johnson, S. Muthukrishnan, Vladislav Shkapenyuk",International Conference on Management of Data,564719
693,A scalable hash ripple join algorithm,2002,"Gang Luo, Curt J. Ellmann, Peter J. Haas, Jeffrey F. Naughton",International Conference on Management of Data,564721
694,Exploiting statistics on query expressions for optimization,2002,"Nicolas Bruno, Surajit Chaudhuri",International Conference on Management of Data,564722
695,Partial results for online query processing,2002,"Vijayshankar Raman, Joseph M. Hellerstein",International Conference on Management of Data,564723
696,Proxy-based acceleration of dynamically generated content on the world wide web: an approach and implementation,2002,"Anindya Datta, Kaushik Dutta, Helen Thomas, Debra VanderMeer,  Suresha, Krithi Ramamritham",International Conference on Management of Data,564703
697,Accelerating XPath location steps,2002,Torsten Grust,International Conference on Management of Data,564705
698,APEX: an adaptive path index for XML data,2002,"Chin-Wan Chung, Jun-Ki Min, Kyuseok Shim",International Conference on Management of Data,564706
699,Covering indexes for branching path queries,2002,"Raghav Kaushik, Philip Bohannon, Jeffrey F Naughton, Henry F Korth",International Conference on Management of Data,564707
700,Implementing database operations using SIMD instructions,2002,"Jingren Zhou, Kenneth A. Ross",International Conference on Management of Data,564709
701,Fractal prefetching B+-Trees: optimizing both cache and disk performance,2002,"Shimin Chen, Phillip B. Gibbons, Todd C. Mowry, Gary Valentin",International Conference on Management of Data,564710
702,Skew handling techniques in sort-merge join,2002,"Wei Li, Dengfeng Gao, Richard Thomas Snodgrass",International Conference on Management of Data,564711
703,StatiX: making XML count,2002,"Juliana Freire, Jayant R. Haritsa, Maya Ramanath, Prasan Roy, J&#233;r&#244;me Sim&#233;on",International Conference on Management of Data,564713
704,HD-Eye: visual clustering of high dimensional data,2002,"Alexander Hinneburg, Daniel A. Keim, Markus Wawryniuk",International Conference on Management of Data,564784
705,GEA: a toolkit for gene expression analysis,2002,"Jessica M. Phan, Raymond Ng",International Conference on Management of Data,564783
706,DBXplorer: enabling keyword search over relational databases,2002,"Sanjay Agrawal, Surajit Chaudhuri, Gautam Das",International Conference on Management of Data,564782
707,CubeExplorer: online exploration of data cubes,2002,"Jiawei Han, Jianyong Wang, Guozhu Dong, Jian Pei, Ke Wang",International Conference on Management of Data,564781
708,XL: a platform for web services,2002,"Daniela Florescu, Andreas Gr&#252;nhagen, Donald Kossmann, Steffen Rost",International Conference on Management of Data,564779
709,RoadRunner: automatic data extraction from data-intensive web sites,2002,"Valter Crescenzi, Giansalvatore Mecca, Paolo Merialdo",International Conference on Management of Data,564778
710,Gigascope: high performance network monitoring with an SQL interface,2002,"Chuck Cranor, Yuan Gao, Theodore Johnson, Vlaidslav Shkapenyuk, Oliver Spatscheck",International Conference on Management of Data,564777
711,Distributing queries over low-power wireless sensor networks,2002,"Samuel Madden, Joseph M. Hellerstein",International Conference on Management of Data,564776
712,COUGAR: the network is the database,2002,"Wai Fu Fung, David Sun, Johannes Gehrke",International Conference on Management of Data,564775
713,"COMMIX: towards effective web information extraction, integration and query answering",2002,"Tengjiao Wang, Shiwei Tang, Dongqing Yang, Jun Gao, Yuqing Wu, Jian Pei",International Conference on Management of Data,564774
714,ACDN: a content delivery network for applications,2002,"Pradnya Karbhari, Michael Rabinovich, Zhen Xiao, Fred Douglis",International Conference on Management of Data,564773
715,XCache: a semantic caching system for XML queries,2002,"Li Chen, Elke A. Rundensteiner, Song Wang",International Conference on Management of Data,564771
716,Visual COKO: a debugger for query optimizer development,2002,"Daniel J. Abadi, Mitch Cherniack",International Conference on Management of Data,564770
717,ToXgene: a template-based data generator for XML,2002,"Denilson Barbosa, Alberto Mendelzon, John Keenleyside, Kelly Lyons",International Conference on Management of Data,564769
718,The XXL search engine: ranked retrieval of XML data using indexes and ontologies,2002,"Anja Theobald, Gerhard Weikum",International Conference on Management of Data,564768
719,Rainbow: mapping-driven XQuery processing system,2002,"Xin Zhang, Mukesh Mulchandani, Steffen Christ, Brian Murphy, Elke A. Rundensteiner",International Conference on Management of Data,564767
720,DBCache: database caching for web application servers,2002,"Mehmet Altinel, Qiong Luo, Sailesh Krishnamurthy, C. Mohan, Hamid Pirahesh, Bruce G. Lindsay, Honguk Woo, Larry Brown",International Conference on Management of Data,564765
721,Learning table access cardinalities with LEO,2002,"Volker Markl, Guy Lohman",International Conference on Management of Data,564766
722,Web caching for database applications with Oracle Web Cache,2002,"Jesse Anton, Lawrence Jacobs, Xiang Liu, Jordan Parker, Zheng Zeng, Tie Zhong",International Conference on Management of Data,564762
723,Middle-tier database caching for e-business,2002,"Qiong Luo, Sailesh Krishnamurthy, C. Mohan, Hamid Pirahesh, Honguk Woo, Bruce G. Lindsay, Jeffrey F. Naughton",International Conference on Management of Data,564763
724,"TPC-DS, taking decision support benchmarking to the next level",2002,"Meikel Poess, Bryan Smith, Lubor Kollar, Paul Larson",International Conference on Management of Data,564759
725,Mid-tier caching: the TimesTen approach,2002,The TimesTen Team,International Conference on Management of Data,564761
726,Automating physical database design in a parallel database,2002,"Jun Rao, Chun Zhang, Nimrod Megiddo, Guy Lohman",International Conference on Management of Data,564757
727,The SDSS skyserver: public access to the sloan digital sky server data,2002,"Alexander S. Szalay, Jim Gray, Ani R. Thakar, Peter Z. Kunszt, Tanu Malik, Jordan Raddick, Christopher Stoughton, Jan vandenBerg",International Conference on Management of Data,564758
728,Efficient execution of joins in a star schema,2002,Andreas Weininger,International Conference on Management of Data,564754
729,Quadtree and R-tree indexes in oracle spatial: a comparison using GIS data,2002,"Ravi Kanth V Kothuri, Siva Ravada, Daniel Abugov",International Conference on Management of Data,564755
730,Garlic: a new flavor of federated query processing for DB2,2002,"Vanja Josifovski, Peter Schwarz, Laura Haas, Eileen Lin",International Conference on Management of Data,564751
731,A compact B-tree,2002,"Peter Bumbulis, Ivan T. Bowman",International Conference on Management of Data,564753
732,Coordinating backup/recovery and data consistency between database and file systems,2002,"Suparna Bhattacharya, C. Mohan, Karen W. Brannon, Inderpal Narang, Hui-I Hsiao, Mahadevan Subramanian",International Conference on Management of Data,564749
733,An ebXML infrastructure implementation through UDDI registries and RosettaNet PIPs,2002,"Asuman Dogac, Yusuf Tambag, Pinar Pembecioglu, Sait Pektas, Gokce Laleci, Gokhan Kurt, Serkan Toprak, Yildiray Kabak",International Conference on Management of Data,564750
734,Wavelet synopses with error guarantees,2002,"Minos Garofalakis, Phillip B. Gibbons",International Conference on Management of Data,564746
735,Compressing SQL workloads,2002,"Surajit Chaudhuri, Ashish Kumar Gupta, Vivek Narasayya",International Conference on Management of Data,564747
736,Systems and prototypes,2002,Jignesh Patel,ACM SIGMOD Record,565138
737,A brief survey of web data extraction tools,2002,"Alberto H. F. Laender, Berthier A. Ribeiro-Neto, Altigran S. da Silva, Juliana S. Teixeira",ACM SIGMOD Record,565137
738,Standards,2002,Andrew Eisenberg,ACM SIGMOD Record,565140
739,Phoenix project: fault-tolerant applications,2002,"Roger Barga, David Lomet",ACM SIGMOD Record,565139
740,Reports,2002,Avigdor Gal,ACM SIGMOD Record,565133
741,Data warehousing and business intelligence for e-commerce: by Alan R. Simon & Steven L. Shaffer,2002,Frank G. Goethals,ACM SIGMOD Record,565132
742,Report on the ACM fourth international workshop on data warehousing and OLAP (DOLAP 2001),2002,Joachim Hammer,ACM SIGMOD Record,565135
743,"On building an infrastructure for mobile and wireless systems: report on the NSF workshop on an infrastructure for mobile and wireless systems, Oct. 15, 2001",2002,"Birgitta K&#246;nig-Ries, Kia Makki, Sam Makki, Charles Perkins, Niki Pissinou, Peter Reiher, Peter Scheuermann, Jari Veijalainen, Ouri Wolfson",ACM SIGMOD Record,565134
744,Book review column,2002,Karl Aberer,ACM SIGMOD Record,565129
745,Book reviews,2002,Karl Aberer,ACM SIGMOD Record,565128
746,"Mining the world wide web: an information search approach by George Chang, Marcus J. Healey (editor), James A. M. McHugh, Jason T. L. Wang",2002,Aris Ouksel,ACM SIGMOD Record,565131
747,Data mining: concepts and techniques by Jiawei Han and Micheline Kamber,2002,"Fernando Berzal, Nicolf&#225;s Mat&#237;n",ACM SIGMOD Record,565130
748,From ternary relationship to relational tables: a case against common beliefs,2002,Rafael Camps Par&#233;,ACM SIGMOD Record,565125
749,Cluster validity methods: part I,2002,"Maria Halkidi, Yannis Batistakis, Michalis Vazirgiannis",ACM SIGMOD Record,565124
750,"David DeWitt speaks out: on rethinking the CS curriculum, why the database community should be proud, why query optimization doesn't work, how supercomputing funding is sometimes very poorly spent, how he's not a good coder and isn't smart enough to do DB theory, and more",2002,Marianne Winslett,ACM SIGMOD Record,565127
751,Distinguished database profiles,2002,Marianne Winslett,ACM SIGMOD Record,565126
752,The design of a retrieval technique for high-dimensional data on tertiary storage,2002,"Ratko Orlandic, Jack Lukaszuk, Craig Swietlik",ACM SIGMOD Record,565120
753,A pictorial query language for querying geographic databases using positional and OLAP operators,2002,"Elaheh Pourabbas, Maurizio Rafanelli",ACM SIGMOD Record,565121
754,Investigating XQuery for querying across database object types,2002,Nancy Wiegand,ACM SIGMOD Record,565122
755,MPEG-7 and multimedia database systems,2002,Harald Kosch,ACM SIGMOD Record,565123
756,"Database tuning: principles, experiments, and troubleshooting techniques (part II)",2002,"Dennis Shasha, Philippe Bonnet",International Conference on Management of Data,564799
757,Software as a service: ASP and ASP aggregation,2002,Christoph Bussler,International Conference on Management of Data,564801
758,Articles,2002,Avigdor Gal,ACM SIGMOD Record,565118
759,Bringing order to query optimization,2002,"Giedrius Slivinskas, Christian S. Jensen, Richard Thomas Snodgrass",ACM SIGMOD Record,565119
760,Implementing XQuery,2002,Paul Cotton,International Conference on Management of Data,564792
761,Querying and mining data streams: you only get one look a tutorial,2002,"Minos Garofalakis, Johannes Gehrke, Rajeev Rastogi",International Conference on Management of Data,564794
762,Tutorial: application servers and associated technologies,2002,C. Mohan,International Conference on Management of Data,564796
763,"Database tuning: principles, experiments, and troubleshooting techniques (part I)",2002,"Dennis Shasha, Philippe Bonnet",International Conference on Management of Data,564798
764,XBase: making your gigabyte disk queriable,2002,"Hongjun Lu, Guoren Wang, Ge Yu, Yubin Bao, Jianhua Lv, Yaxin Yu",International Conference on Management of Data,564785
765,XmdvTool: visual interactive data exploration and trend discovery of high-dimensional data sets,2002,"Elke A. Rundensteiner, Matthew O. Ward, Jing Yang, Punit R. Doshi",International Conference on Management of Data,564786
766,Data streams: fresh current or stagnant backwater? (panel),2002,"Joseph M. Hellerstein, Jennifer Widom",International Conference on Management of Data,564788
767,Going public: open-source databases and database research,2002,Philippe Bonnet,International Conference on Management of Data,564790
768,Algorithms for Mining Distance-Based Outliers in Large Datasets,1998,"Edwin M. Knorr, Raymond T. Ng",Very Large Data Bases,671334
769,"Information, Communication, and Money: For What Can We Charge and How Can We Meter It?",1998,"Stephen Blott, Henry F. Korth, Abraham Silberschatz",Very Large Data Bases,671333
770,From Data Independence to Knowledge Independence: An on-going Story,1998,Laurent Vieille,Very Large Data Bases,671336
771,Materialized Views in Oracle,1998,"Randall G. Bello, Karl Dias, Alan Downing, James J. Feenan, Jr., James L. Finnerty, William D. Norcott, Harry Sun, Andrew Witkowski, Mohamed Ziauddin",Very Large Data Bases,671335
772,Computing Iceberg Queries Efficiently,1998,"Min Fang, Narayanan Shivakumar, Hector Garcia-Molina, Rajeev Motwani, Jeffrey D. Ullman",Very Large Data Bases,671338
773,"TOPAZ: a Cost-Based, Rule-Driven, Multi-Phase Parallelizer",1998,"Clara Nippl, Bernhard Mitschang",Very Large Data Bases,671337
774,Scalable Sweeping-Based Spatial Join,1998,"Lars Arge, Octavian Procopiuc, Sridhar Ramaswamy, Torsten Suel, Jeffrey Scott Vitter",Very Large Data Bases,671340
775,R-Tree Based Indexing of Now-Relative Bitemporal Data,1998,"Rasa Bliujute, Christian S. Jensen, Simonas Saltenis, Giedrius Slivinskas",Very Large Data Bases,671339
776,WaveCluster: A Multi-Resolution Clustering Approach for Very Large Spatial Databases,1998,"Gholamhosein Sheikholeslami, Surojit Chatterjee, Aidong Zhang",Very Large Data Bases,671342
777,Evaluating Functional Joins Along Nested Reference Sets in Object-Relational and Object-Oriented Databases,1998,"Reinhard Braumandl, Jens Clau&#223;en, Alfons Kemper",Very Large Data Bases,671341
778,Binding Propagation in Disjunctive Databases,1998,Sergio Greco,Very Large Data Bases,671344
779,Atomicity versus Anonymity: Distributed Transactions for Electronic Commerce,1998,J. D. Tygar,Very Large Data Bases,671343
780,Proximity Search in Databases,1998,"Roy Goldman, Narayanan Shivakumar, Suresh Venkatasubramanian, Hector Garcia-Molina",Very Large Data Bases,671346
781,Active Storage for Large-Scale Data Mining and Multimedia,1998,"Erik Riedel, Garth A. Gibson, Christos Faloutsos",Very Large Data Bases,671345
782,Query Optimization for XML,1999,"Jason McHugh, Jennifer Widom",Very Large Data Bases,671349
783,Aqua: A Fast Decision Support Systems Using Approximate Query Answers,1999,"Swarup Acharya, Phillip B. Gibbons, Viswanath Poosala",Very Large Data Bases,671347
784,Building Light-Weight Wrappers for Legacy Web Data-Sources Using W4F,1999,"Arnaud Sahuguet, Fabien Azavant",Very Large Data Bases,671350
785,Performance Measurements of Compressed Bitmap Indices,1999,Theodore Johnson,Very Large Data Bases,671351
786,Curio: A Novel Solution for Efficient Storage and Indexing in Data Warehouses,1999,"Anindya Datta, Krithi Ramamritham, Helen M. Thomas",Very Large Data Bases,671352
787,"The New Locking, Logging, and Recovery Architecture of Microsoft SQL Server 7.0",1999,David Campbell,Very Large Data Bases,671353
788,Unrolling Cycles to Decide Trigger Termination,1999,"Sin Yeung Lee, Tok Wang Ling",Very Large Data Bases,671354
789,Aggregation Algorithms for Very Large Compressed Data Warehouses,1999,"Jianzhong Li, Doron Rotem, Jaideep Srivastava",Very Large Data Bases,671355
790,Quality-driven Integration of Heterogenous Information Systems,1999,"Felix Naumann, Ulf Leser, Johann Christoph Freytag",Very Large Data Bases,671356
791,Implementation of Two Semantic Query Optimization Techniques in DB2 Universal Database,1999,"Qi Cheng, Jarek Gryz, Fred Koo, T. Y. Cliff Leung, Linqi Liu, Xiaoyan Qian, K. Bernhard Schiefer",Very Large Data Bases,671357
792,High-Performance Extensible Indexing,1999,Marcel Kornacker,Very Large Data Bases,671358
793,Evaluating Top-k Selection Queries,1999,"Surajit Chaudhuri, Luis Gravano",Very Large Data Bases,671359
794,Building Hierarchical Classifiers Using Class Proximity,1999,"Ke Wang, Senqiang Zhou, Shiang Chen Liew",Very Large Data Bases,671360
795,VOODB: A Generic Discrete-Event Random Simulation Model To Evaluate the Performances of OODBs,1999,"J&#233;r&#244;me Darmont, Michel Schneider",Very Large Data Bases,671361
796,Cache Conscious Indexing for Decision-Support in Main Memory,1999,"Jun Rao, Kenneth A. Ross",Very Large Data Bases,671362
797,An Adaptive Hybrid Server Architecture for Client Caching ODBMSs,1999,"Kaladhar Voruganti, M. Tamer &#214;zsu, Ronald C. Unrau",Very Large Data Bases,671363
798,Database Architecture Optimized for the New Bottleneck: Memory Access,1999,"Peter A. Boncz, Stefan Manegold, Martin L. Kersten",Very Large Data Bases,671364
799,Hierarchical Prefix Cubes for Range-Sum Queries,1999,"Chee Yong Chan, Yannis E. Ioannidis",Very Large Data Bases,671365
800,Cost Models DO Matter: Providing Cost Information for Diverse Data Sources in a Federated System,1999,"Mary Tork Roth, Fatma Ozcan, Laura M. Haas",Very Large Data Bases,671494
801,Optimization of Run-time Management of Data Intensive Web-sites,1999,"Daniela Florescu, Alon Y. Levy, Dan Suciu, Khaled Yagoub",Very Large Data Bases,671493
802,Issues in Network Management in the Next Millennium,1999,"Michael L. Brodie, Surajit Chaudhuri",Very Large Data Bases,671492
803,Extending Practical Pre-Aggregation in On-Line Analytical Processing,1999,"Torben Bach Pedersen, Christian S. Jensen, Curtis E. Dyreson",Very Large Data Bases,671491
804,Context-Based Prefetch for Implementing Objects on Relations,1999,"Philip A. Bernstein, Shankar Pal, David Shutt",Very Large Data Bases,671498
805,XML Repository and Active Views Demonstration,1999,"Serge Abiteboul, Vincent Aguilera, S&#233;bastien Ailleret, Bernd Amann, Sophie Cluet, Brendan Hills, Fr&#233;d&#233;ric Hubert, Jean-Claude Mamou, Am&#233;lie Marian, Laurent Mignet, Tova Milo, Cassio Souza dos Santos, Bruno Tessier, Anne-Marie Vercoustre",Very Large Data Bases,671497
806,High Level Indexing of User-Defined Types,1999,"Weidong Chen, Jyh-Herng Chow, You-Chin Fuh, Jean Grandbois, Michelle Jou, Nelson Mendon&#231;a Mattos, Brian T. Tran, Yun Wang",Very Large Data Bases,671496
807,Dynamic Load Balancing for Parallel Association Rule Mining on Heterogenous PC Cluster Systems,1999,"Masahisa Tamura, Masaru Kitsuregawa",Very Large Data Bases,671495
808,"Industrial Panel on Data Warehousing Technologies: Experiences, Challenges, and Directions",1999,Umeshwar Dayal,Very Large Data Bases,671502
809,Multi-Dimensional Substring Selectivity Estimation,1999,"H. V. Jagadish, Olga Kapitskaia, Raymond T. Ng, Divesh Srivastava",Very Large Data Bases,671501
810,Explaining Differences in Multidimensional Aggregates,1999,Sunita Sarawagi,Very Large Data Bases,671500
811,Relational Databases for Querying XML Documents: Limitations and Opportunities,1999,"Jayavel Shanmugasundaram, Kristin Tufte, Chun Zhang, Gang He, David J. DeWitt, Jeffrey F. Naughton",Very Large Data Bases,671499
812,Generalised Hash Teams for Join and Group-by,1999,"Alfons Kemper, Donald Kossmann, Christian Wiesner",Very Large Data Bases,671506
