id,title,year,authors,venue,entityUrl
1162,Graphical interaction with heterogeneous databases,1997,"T. Catarci, G. Santucci, J. Cardiff",The VLDB Journal &mdash; The International Journal on Very Large Data Bases,765550
1163,A database model for object dynamics,1997,"M. P. Papazoglou, B. J. Kr&#228;mer",The VLDB Journal &mdash; The International Journal on Very Large Data Bases,765549
1164,Parametric query optimization,1997,"Yannis E. Ioannidis, Raymond T. Ng, Kyuseok Shim, Timos K. Sellis",The VLDB Journal &mdash; The International Journal on Very Large Data Bases,765552
1165,On applying hash filters to improving the execution of multi-join queries,1997,"Ming-Syan Chen, Hui-I Hsiao, Philip S. Yu",The VLDB Journal &mdash; The International Journal on Very Large Data Bases,765551
1166,The impact of object technology on commercial transaction processing,1997,Edward E. Cobb,The VLDB Journal &mdash; The International Journal on Very Large Data Bases,765555
1167,Concurrency control in hierarchical multidatabase systems,1997,"Sharad Mehrotra, Henry F. Korth, Avi Silberschatz",The VLDB Journal &mdash; The International Journal on Very Large Data Bases,765553
1168,Introduction,1998,"M. Tamer &#214;zsu, Stavros Christodoulakis",The VLDB Journal &mdash; The International Journal on Very Large Data Bases,765537
1169,Spatial and temporal content-based access to hypervideo databases,1998,"Haitao Jiang, Ahmed K. Elmagarmid",The VLDB Journal &mdash; The International Journal on Very Large Data Bases,765538
1170,Optimal clip ordering for multi-clip queries,1998,"Raymond T. Ng, Paul Shum",The VLDB Journal &mdash; The International Journal on Very Large Data Bases,765539
1171,Integrating symbolic images into a multimedia database system using classification and abstraction approaches,1998,"Aya Soffer, Hanan Samet",The VLDB Journal &mdash; The International Journal on Very Large Data Bases,765540
1172,Approximate similarity retrieval with M-trees,1998,"Pavel Zezula, Pasquale Savino, Giuseppe Amato, Fausto Rabitti",The VLDB Journal &mdash; The International Journal on Very Large Data Bases,765541
1173,Delivering presentations from multimedia servers,1998,"Nevzat Hurkan Balkir, Gultekin Ozsoyoglu",The VLDB Journal &mdash; The International Journal on Very Large Data Bases,765542
1174,"The hB $^\\Pi$-tree: a multi-attribute index supporting concurrency, recovery and node consolidation",1997,"Georgios Evangelidis, David Lomet, Betty Salzberg",The VLDB Journal &mdash; The International Journal on Very Large Data Bases,765544
1175,Dictionary-based order-preserving string compression,1997,Gennady Antoshenkov,The VLDB Journal &mdash; The International Journal on Very Large Data Bases,765545
1176,A logical view of structured files,1998,"Serge Abiteboul, Sophie Cluet, Tova Milo",The VLDB Journal &mdash; The International Journal on Very Large Data Bases,765527
1177,Fast image retrieval using color-spatial information,1998,"Beng Chin Ooi, Kian-Lee Tan, Tat Seng Chua, Wynne Hsu",The VLDB Journal &mdash; The International Journal on Very Large Data Bases,765528
1178,Guest Editorial,1998,Matthias Jarke,The VLDB Journal &mdash; The International Journal on Very Large Data Bases,765530
1179,Enhanced abstract data types in object-relational databases,1998,Praveen Seshadri,The VLDB Journal &mdash; The International Journal on Very Large Data Bases,765531
1180,Integrated document caching and prefetching in storage hierarchies based on Markov-chain predictions,1998,"Achim Kraiss, Gerhard Weikum",The VLDB Journal &mdash; The International Journal on Very Large Data Bases,765532
1181,"Scalable feature selection, classification and signature generation for organizing large text databases into hierarchical topic taxonomies",1998,"Soumen Chakrabarti, Byron Dom, Rakesh Agrawal, Prabhakar Raghavan",The VLDB Journal &mdash; The International Journal on Very Large Data Bases,765533
1182,Garbage collection in object-oriented databases using transactional cyclic reference counting,1998,"P. Roy, S. Seshadri, A. Silberschatz, S. Sudarshan, S. Ashwin",The VLDB Journal &mdash; The International Journal on Very Large Data Bases,765534
1183,Integrating reliable memory in databases,1998,"Wee Teck Ng, Peter M. Chen",The VLDB Journal &mdash; The International Journal on Very Large Data Bases,765535
1184,Speeding up construction of PMR quadtree-based spatial indexes,2002,"Gisli R. Hjaltason, Hanan Samet",The VLDB Journal &mdash; The International Journal on Very Large Data Bases,767129
1185,Spatial indexing of high-dimensional data based on relative approximation,2002,"Yasushi Sakurai, Masatoshi Yoshikawa, Shunsuke Uemura, Haruhiko Kojima",The VLDB Journal &mdash; The International Journal on Very Large Data Bases,767128
1186,Query processing techniques for arrays,2002,"Arunprasad P. Marathe, Kenneth Salem",The VLDB Journal &mdash; The International Journal on Very Large Data Bases,767098
1187,An authorization system for digital libraries,2002,"E. Ferrari, N.R. Adam, V. Atluri, E. Bertino, U. Capuozzo",The VLDB Journal &mdash; The International Journal on Very Large Data Bases,767097
1188,Designing wrapper components for e-services in integrating heterogeneous systems,2001,"Massimo Mecella, Barbara Pernici",The VLDB Journal &mdash; The International Journal on Very Large Data Bases,767134
1189,Guest editorial,2001,"Fabio Casati, Ming-Chien Shan, Dimitrios Georgakopoulos",The VLDB Journal &mdash; The International Journal on Very Large Data Bases,767133
1190,A template model for multidimensional inter-transactional association rules,2002,"Ling Feng, Jeffrey Xu Yu, Hongjun Lu, Jiawei Han",The VLDB Journal &mdash; The International Journal on Very Large Data Bases,767131
1191,Efficient similarity search for market basket data,2002,"Alexandros Nanopoulos, Yannis Manolopoulos",The VLDB Journal &mdash; The International Journal on Very Large Data Bases,767130
1192,Semantic and schematic similarities between database objects: a context-based approach,1996,"Vipul Kashyap, Amit Sheth",The VLDB Journal &mdash; The International Journal on Very Large Data Bases,765855
1193,An asymptotically optimal multiversion B-tree,1996,"Bruno Becker, Stephan Gschwind, Thomas Ohler, Bernhard Seeger, Peter Widmayer",The VLDB Journal &mdash; The International Journal on Very Large Data Bases,765854
1194,Building knowledge base management systems,1996,"John Mylopoulos, Vinay Chaudhri, Dimitris Plexousakis, Adel Shrufi, Thodoros Topologlou",The VLDB Journal &mdash; The International Journal on Very Large Data Bases,765853
1195,Query processing and optimization in Oracle Rdb,1996,"Gennady Antoshenkov, Mohamed Ziauddin",The VLDB Journal &mdash; The International Journal on Very Large Data Bases,765852
1196,Locating and accessing data repositories with WebSemantics,2002,"George A. Mihaila, Louiqa Raschid, Anthony Tomasic",The VLDB Journal &mdash; The International Journal on Very Large Data Bases,767096
1197,Searching in metric spaces by spatial approximation,2002,Gonzalo Navarro,The VLDB Journal &mdash; The International Journal on Very Large Data Bases,767095
1198,Efficient retrieval of similar shapes,2002,"Davood Rafiei, Alberto O. Mendelzon",The VLDB Journal &mdash; The International Journal on Very Large Data Bases,767094
1199,Indexing of now-relative spatio-bitemporal data,2002,"Simonas &#352;altenis, Christian S. Jensen",The VLDB Journal &mdash; The International Journal on Very Large Data Bases,767093
1200,Join algorithm costs revisited,1996,"Evan P. Harris, Kotagiri Ramamohanarao",The VLDB Journal &mdash; The International Journal on Very Large Data Bases,765755
1201,A taxonomy of correctness criteria in database applications,1996,"Krithi Ramamritham, Panos K. Chrysanthis",The VLDB Journal &mdash; The International Journal on Very Large Data Bases,765756
1202,A predicate-based caching scheme for client-server database architectures,1996,"Arthur M. Keller, Julie Basu",The VLDB Journal &mdash; The International Journal on Very Large Data Bases,765753
1203,Mariposa: a wide-area distributed database system,1996,"Michael Stonebraker, Paul M. Aoki, Witold Litwin, Avi Pfeffer, Adam Sah, Jeff Sidell, Carl Staelin, Andrew Yu",The VLDB Journal &mdash; The International Journal on Very Large Data Bases,765754
1204,Access path support for referential integrity in SQL2,1996,"Theo H&#228;rder, Joachim Reinert",The VLDB Journal &mdash; The International Journal on Very Large Data Bases,765805
1205,Index nesting - an efficient approach to indexing in object-oriented databases,1996,"Beng Chin Ooi, Jiawei Han, Hongjun Lu, Kian Lee Tan",The VLDB Journal &mdash; The International Journal on Very Large Data Bases,765806
1206,A complete temporal relational algebra,1996,"Debabrata Dey, Terence M. Barron, Veda C. Storey",The VLDB Journal &mdash; The International Journal on Very Large Data Bases,765803
1207,The design and implementation of K: a high-level knowledge-base programming language of OSAM*.KBMS,1996,"Yuh-Ming Shyy, Javier Arroyo, Stanley Y.W. Su, Herman Lam",The VLDB Journal &mdash; The International Journal on Very Large Data Bases,765804
1208,The GMAP: a versatile tool for physical data independence,1996,"Odysseas G. Tsatalos, Marvin H. Solomon, Yannis E. Ioannidis",The VLDB Journal &mdash; The International Journal on Very Large Data Bases,765690
1209,Algebraic query optimisation for database programming languages,1996,"Alexandra Poulovassilis, Carol Small",The VLDB Journal &mdash; The International Journal on Very Large Data Bases,765691
1210,A configurable type hierarchy index for OODB,1997,"Thomas A. Mueck, Martin L. Polaschek",The VLDB Journal &mdash; The International Journal on Very Large Data Bases,765565
1211,Using extended feature objects for partial similarity retrieval,1997,"Stefan Berchtold, Daniel A. Keim, Hans-Peter Kriegel",The VLDB Journal &mdash; The International Journal on Very Large Data Bases,765566
1212,Parallelizing OODBMS traversals: a performance evaluation,1996,"David J. De Witt, Jeffrey F. Naughton, John C. Shafer, Shivakumar Venkataraman",The VLDB Journal &mdash; The International Journal on Very Large Data Bases,765751
1213,Priority assignment in real-time active databases,1996,"Rajendran M. Sivasankaran, John A. Stankovic, Don Towsley, Bhaskar Purimetla, Krithi Ramamritham",The VLDB Journal &mdash; The International Journal on Very Large Data Bases,765752
1214,Type-safe relaxing of schema consistency rules for flexible modelling in OODBMS,1996,"Eric Amiel, Marie-Jo Bellosta, Eric Dujardin, Eric Simon",The VLDB Journal &mdash; The International Journal on Very Large Data Bases,765692
1215,An experimental object-based sharing system for networked databases,1996,"Doug Fang, Shahram Ghandeharizadeh, Dennis McLeod",The VLDB Journal &mdash; The International Journal on Very Large Data Bases,765693
1216,Guest editorial,2000,"Paolo Atzeni, Alberto O. Mendelzon",The VLDB Journal &mdash; The International Journal on Very Large Data Bases,765219
1217,Optimizing multiple dimensional queries simultaneously in multidimensional databases,2000,"Weifa Liang, Maria E. Orlowska, Jeffrey X. Yu",The VLDB Journal &mdash; The International Journal on Very Large Data Bases,764223
1218,Learning response time for WebSources using query feedback and application in query optimization,2000,"Jean-Robert Gruser, Louiqa Raschid, Vladimir Zadorozhny, Tao Zhan",The VLDB Journal &mdash; The International Journal on Very Large Data Bases,765221
1219,Semantic caching of Web queries,2000,"Boris Chidlovskii, Uwe M. Borghoff",The VLDB Journal &mdash; The International Journal on Very Large Data Bases,765220
1220,Effective timestamping in databases,2000,"Kristian Torp, Christian S. Jensen, Richard Thomas Snodgrass",The VLDB Journal &mdash; The International Journal on Very Large Data Bases,764220
1221,Quantifiable data mining using ratio rules,2000,"Flip Korn, Alexandros Labrinidis, Yannis Kotidis, Christos Faloutsos",The VLDB Journal &mdash; The International Journal on Very Large Data Bases,764219
1222,Update propagation strategies to improve freshness in lazy master replicated databases,2000,"Esther Pacitti, Eric Simon",The VLDB Journal &mdash; The International Journal on Very Large Data Bases,764222
1223,WaveCluster: a wavelet-based clustering approach for spatial data in very large databases,2000,"Gholamhosein Sheikholeslami, Surojit Chatterjee, Aidong Zhang",The VLDB Journal &mdash; The International Journal on Very Large Data Bases,764221
1224,The LHAM log-structured history data access method,2000,"Peter Muth, Patrick O'Neil, Achim Pick, Gerhard Weikum",The VLDB Journal &mdash; The International Journal on Very Large Data Bases,764216
1225,Secure buffering in firm real-time database systems,2000,"Binto George, Jayant R. Haritsa",The VLDB Journal &mdash; The International Journal on Very Large Data Bases,764215
1226,Distance-based outliers: algorithms and applications,2000,"Edwin M. Knorr, Raymond T. Ng, Vladimir Tucakov",The VLDB Journal &mdash; The International Journal on Very Large Data Bases,764218
1227,Clustering categorical data: an approach based on dynamical systems,2000,"David Gibson, Jon Kleinberg, Prabhakar Raghavan",The VLDB Journal &mdash; The International Journal on Very Large Data Bases,764217
1228,An XML query engine for network-bound data,2002,"Zachary G. Ives, A. Y. Halevy, D. S. Weld",The VLDB Journal &mdash; The International Journal on Very Large Data Bases,764206
1229,Efficient filtering of XML documents with XPath expressions,2002,"C.-Y. Chan, P. Felber, M. Garofalakis, R. Rastogi",The VLDB Journal &mdash; The International Journal on Very Large Data Bases,764205
1230,Functional-join processing,2000,"R. Braumandl, J. Claussen, A. Kemper, D. Kossmann",The VLDB Journal &mdash; The International Journal on Very Large Data Bases,764214
1231,Foreword by the VLDB '98 PC Chairmen,2000,"O. Shmueli, J. Widom",The VLDB Journal &mdash; The International Journal on Very Large Data Bases,764213
1232,TIMBER: A native XML database,2002,"H. V. Jagadish, S. Al-Khalifa, A. Chapman, L. V. S. Lakshmanan, A. Nierman, S. Paparizos, J. M. Patel, D. Srivastava, N. Wiwatwattana, Y. Wu, C. Yu",The VLDB Journal &mdash; The International Journal on Very Large Data Bases,764201
1233,Anatomy of a native XML base management system,2002,"T. Fiebig, S. Helmer, C.-C. Kanne, G. Moerkotte, J. Neumann, R. Schiele, T. Westmann",The VLDB Journal &mdash; The International Journal on Very Large Data Bases,764202
1234,Tree pattern query minimization,2002,"S. Amer-Yahia, S. Cho, L. V. S. Lakshmanan, D. Srivastava",The VLDB Journal &mdash; The International Journal on Very Large Data Bases,764203
1235,Efficient schemes for managing multiversionXML documents,2002,"S.-Y. Chien, V. J. Tsotras, C. Zaniolo",The VLDB Journal &mdash; The International Journal on Very Large Data Bases,764204
1236,Description logics for semantic query optimization in object-oriented database systems,2003,"Domenico Beneventano, Sonia Bergamaschi, Claudio Sartori",ACM Transactions on Database Systems (TODS),762472
1237,A simple algorithm for finding frequent elements in streams and bags,2003,"Richard M. Karp, Scott Shenker, Christos H. Papadimitriou",ACM Transactions on Database Systems (TODS),762473
1238,Adaptive algorithms for set containment joins,2003,"Sergey Melnik, Hector Garcia-Molina",ACM Transactions on Database Systems (TODS),762474
1239,Guest Editorial,2002,Alon Y. Halevy,The VLDB Journal &mdash; The International Journal on Very Large Data Bases,764200
1240,PicoDMBS: Scaling Down Database Techniques for the Smartcard,2000,"Christophe Bobineau, Luc Bouganim, Philippe Pucheral, Patrick Valduriez",Very Large Data Bases,758380
1241,PicoDBMS: Validation and Experience,2001,"Nicolas Anciaux, Christophe Bobineau, Luc Bouganim, Philippe Pucheral, Patrick Valduriez",Very Large Data Bases,758381
1242,NetCube: A Scalable Tool for Fast Data Mining and Compression,2001,"Dimitris Margaritis, Christos Faloutsos, Sebastian Thrun",Very Large Data Bases,758382
1243,DB2 Spatial Extender - Spatial data within the RDBMS,2001,David W. Adler,Very Large Data Bases,758383
1244,The Persistent Cache: Improving OID Indexing in Temporal Object-Oriented Database Systems,1999,Kjetil N&#248;rv&#229;g,Very Large Data Bases,758375
1245,Efficient Numerical Error Bounding for Replicated Network Services,2000,"Haifeng Yu, Amin Vahdat",Very Large Data Bases,758377
1246,Memex: A Browsing Assistant for Collaborative Archiving and Mining of Surf Trails,2000,"Soumen Chakrabarti, Sandeep Srivastava, Mallela Subramanyam, Mitul Tiwari",Very Large Data Bases,758378
1247,Building and Customizing Data-Intensive Web Sites Using Weave,2000,"Khaled Yagoub, Daniela Florescu, Val&#233;rie Issarny, Patrick Valduriez",Very Large Data Bases,758379
1248,"Advanced data processing in KRISYS: modeling concepts, implementation techniques, and client/server issues",1998,"Stefan De&#223;loch, Theo H&#228;rder, Nelson Mattos, Bernhard Mitschang, Joachim Thomas",The VLDB Journal &mdash; The International Journal on Very Large Data Bases,765526
1249,Maintenance of implication integrity constraints under updates to constraints,1998,"Naci S. Ishakbeyoglu, Z. Meral Ozsoyoglu",The VLDB Journal &mdash; The International Journal on Very Large Data Bases,765525
1250,Data partitioning and load balancing in parallel disk systems,1998,"Peter Scheuermann, Gerhard Weikum, Peter Zabback",The VLDB Journal &mdash; The International Journal on Very Large Data Bases,765523
1251,The OODB path-method generator (PMG) using access weights and precomputed access relevance,1998,"Ashish Mehta, James Geller, Yehoshua Perl, Erich Neuhold",The VLDB Journal &mdash; The International Journal on Very Large Data Bases,765522
1252,A flexible and recoverable client/server database event notification system,1998,"Eric N. Hanson, I.-Cheng Chen, Roxana Dastur, Kurt Engel, Vijay Ramaswamy, Wendy Tan, Chun Xu",The VLDB Journal &mdash; The International Journal on Very Large Data Bases,765521
1253,"Optimizing relational queries in connection hypergraphs: nested queries, views, and binding propagations",1998,Jia Liang Han,The VLDB Journal &mdash; The International Journal on Very Large Data Bases,765520
1254,OPT++ : an object-oriented implementation for extensible database query optimization,1999,"Navin Kabra, David J. DeWitt",The VLDB Journal &mdash; The International Journal on Very Large Data Bases,765518
1255,Constant time permutation: an efficient block allocation strategy for variable-bit-rate continuous media data,1999,"Yueh-Min Huang, Jen-Wen Ding, Shiao-Li Tsao",The VLDB Journal &mdash; The International Journal on Very Large Data Bases,765517
1256,The intrinsic problems of structural heterogeneity and an approach to their solution,1999,"Theo H&#228;rder, G&#252;nter Sauter, Joachim Thomas",The VLDB Journal &mdash; The International Journal on Very Large Data Bases,765516
1257,Fast joins using join indices,1999,"Zhe Li, Kenneth A. Ross",The VLDB Journal &mdash; The International Journal on Very Large Data Bases,765515
1258,Efficient support for interactive service in multi-resolution VOD systems,1999,"Kelvin K. W. Law, John C. S. Lui, Leana Golubchik",The VLDB Journal &mdash; The International Journal on Very Large Data Bases,765513
1259,Semantic heterogeneity resolution in federated databases by metadata implantation and stepwise evolution,1999,"Goksel Aslan, Dennis McLeod",The VLDB Journal &mdash; The International Journal on Very Large Data Bases,765512
1260,MIL primitives for querying a fragmented world,1999,"Peter A. Boncz, Martin L. Kersten",The VLDB Journal &mdash; The International Journal on Very Large Data Bases,765511
1261,Deadlock detection in distributed database systems: a new algorithm and a comparative performance analysis,1999,"Natalija Krivokapi&#263;, Alfons Kemper, Ehud Gudes",The VLDB Journal &mdash; The International Journal on Very Large Data Bases,765510
1262,Indexing very high-dimensional sparse and quasi-sparse vectors for similarity searches,2001,"Changzhou Wang, X. Sean Wang",The VLDB Journal &mdash; The International Journal on Very Large Data Bases,765508
1263,A graph-theoretic model for optimizing queries involving methods,2001,"Chiang Lee, Chi-Sheng Shih, Yaw-Huei Chen",The VLDB Journal &mdash; The International Journal on Very Large Data Bases,765507
1264,HMAP- A temporal data model managing intervals with different granularities and indeterminacy from natural language sentences,2001,"Carlo Combi, Giuseppe Pozzi",The VLDB Journal &mdash; The International Journal on Very Large Data Bases,765505
1265,Supporting efficient multimedia database exploration,2001,"Wen-Syan Li, K.Sel&#231;uk Candan, Kyoji Hirata, Yoshinori Hara",The VLDB Journal &mdash; The International Journal on Very Large Data Bases,765506
1266,Progressive evaluation of nested aggregate queries,2000,"Kian-Lee Tan, Cheng Hian Goh, Beng Chin Ooi",The VLDB Journal &mdash; The International Journal on Very Large Data Bases,765240
1267,Combining multi-visual features for efficient indexing in a large image database,2001,"Anne H. H. Ngu, Quan Z. Sheng, Du Q. Huynh, Ron Lei",The VLDB Journal &mdash; The International Journal on Very Large Data Bases,765504
1268,Optimizing database architecture for the new bottleneck: memory access,2000,"Stefan Manegold, Peter A. Boncz, Martin L. Kersten",The VLDB Journal &mdash; The International Journal on Very Large Data Bases,765238
1269,Online dynamic reordering,2000,"Vijayshankar Raman, Bhaskaran Raman, Joseph M. Hellerstein",The VLDB Journal &mdash; The International Journal on Very Large Data Bases,765239
1270,Exploiting early sorting and early partitioning for decision support query processing,2000,"J. Claussen, A. Kemper, D. Kossmann, C. Wiesner",The VLDB Journal &mdash; The International Journal on Very Large Data Bases,765236
1271,One-dimensional and multi-dimensional substring selectivity estimation,2000,"H. V. Jagadish, Olga Kapitskaia, Raymond T. Ng, Divesh Srivastava",The VLDB Journal &mdash; The International Journal on Very Large Data Bases,765237
1272,Guest editorial,2000,Malcolm P. Atkinson,The VLDB Journal &mdash; The International Journal on Very Large Data Bases,765234
1273,Context-based prefetch - an optimization for implementing objects on relations,2000,"Philip A. Bernstein, Shankar Pal, David Shutt",The VLDB Journal &mdash; The International Journal on Very Large Data Bases,765235
1274,View management in multimedia databases,2000,"K. Sel&#231;uk Candan, Eric Lemar, V. S. Subrahmanian",The VLDB Journal &mdash; The International Journal on Very Large Data Bases,765231
1275,Dynamic vp-tree indexing for n-nearest neighbor search given pair-wise distances,2000,"Ada Wai-chee Fu, Polly Mei-shuen Chan, Yin-Ling Cheung, Yiu Sang Moon",The VLDB Journal &mdash; The International Journal on Very Large Data Bases,765232
1276,UnQL: a query language and algebra for semistructured data based on structural recursion,2000,"Peter Buneman, Mary Fernandez, Dan Suciu",The VLDB Journal &mdash; The International Journal on Very Large Data Bases,765224
1277,Checking the temporal integrity of interactive multimedia documents,2000,"I. Mirbel, B. Pernici, T. Sellis, S. Tserkezoglou, M. Vazirgiannis",The VLDB Journal &mdash; The International Journal on Very Large Data Bases,765230
1278,Declarative specification of Web sites with S,2000,"Mary Fern&#225;ndez, Daniela Florescu, Alon Levy, Dan Suciu",The VLDB Journal &mdash; The International Journal on Very Large Data Bases,765222
1279,Analysis of navigation behaviour in web sites integrating multiple information systems,2000,"Bettina Berendt, Myra Spiliopoulou",The VLDB Journal &mdash; The International Journal on Very Large Data Bases,765223
1280,Mining Multi-Dimensional Constrained Gradients in Data Cubes,2001,"Guozhu Dong, Jiawei Han, Joyce M. W. Lam, Jian Pei, Ke Wang",Very Large Data Bases,672176
1281,Storage and Querying of E-Commerce Data,2001,"Rakesh Agrawal, Amit Somani, Yirong Xu",Very Large Data Bases,672175
1282,Surfing Wavelets on Streams: One-Pass Summaries for Approximate Aggregate Queries,2001,"Anna C. Gilbert, Yannis Kotidis, S. Muthukrishnan, Martin Strauss",Very Large Data Bases,672174
1283,Data Staging for On-Demand Broadcast,2001,"Demet Aksoy, Michael J. Franklin, Stanley B. Zdonik",Very Large Data Bases,672046
1284,Data Management for Pervasive Computing,2001,"Mitch Cherniack, Michael J. Franklin, Stanley B. Zdonik",Very Large Data Bases,672180
1285,Flexible and scalable digital library search,2001,"Henk Ernst Blok, Menzo Windhouwer, Roelof van Zwol, Milan Petkovic, Peter M. G. Apers, Martin L. Kersten, Willem Jonker",Very Large Data Bases,672179
1286,Indexing the Distance: An Efficient Method to KNN Processing,2001,"Cui Yu, Beng Chin Ooi, Kian-Lee Tan, H. V. Jagadish",Very Large Data Bases,672178
1287,An Extendible Hash for Multi-Precision Similarity Querying of Image Databases,2001,"Shu Lin, M. Tamer &#214;zsu, Vincent Oria, Raymond T. Ng",Very Large Data Bases,672177
1288,Collaborative Analytical Processing - Dream or Reality? (Panel abstract),2001,"William O'Connell, Andrew Witkowski, Goetz Graefe",Very Large Data Bases,672185
1289,A Data Warehousing Architecture for Enabling Service Provisioning Process,2001,Yannis Kotidis,Very Large Data Bases,672183
1290,Aggregate Maintenance for Data Warehousing in Informix Red Brick Vista,2001,"Craig J. Bunker, Latha S. Colby, Richard L. Cole, William J. McKenna, Gopal Mulagund, David Wilhite",Very Large Data Bases,672182
1291,Self-similarity in the Web,2001,"Stephen Dill, Ravi Kumar, Kevin S. McCurley, Sridhar Rajagopalan, D. Sivakumar, Andrew Tomkins",Very Large Data Bases,672181
1292,Supervised Wrapper Generation with Lixto,2001,"Robert Baumgartner, Sergio Flesca, Georg Gottlob",Very Large Data Bases,672189
1293,Dynamic Pipeline Scheduling for Improving Interactive Query Performance,2001,"Tolga Urhan, Michael J. Franklin",Very Large Data Bases,672188
