id,title,year,authors,venue,entityUrl
1630,UniSQL/X unified relational and object-oriented database system,1994,Won Kim,International Conference on Management of Data,191938
1631,ODMG-93: a standard for object-oriented DBMSs,1994,R. G. G. Cattell,International Conference on Management of Data,191937
1632,Optimizing disjunctive queries with expensive predicates,1994,"A. Kemper, G. Moerkotte, K. Peithner, M. Steinbrunn",International Conference on Management of Data,191906
1633,Outerjoins as disjunctions,1994,C&#233;sar A. Galindo-Legaria,International Conference on Management of Data,191908
1634,From structured documents to novel query facilities,1994,"V. Christophides, S. Abiteboul, S. Cluet, M. Scholl",International Conference on Management of Data,191901
1635,Practical predicate placement,1994,Joseph M. Hellerstein,International Conference on Management of Data,191904
1636,Incremental updates of inverted lists for text document retrieval,1994,"Anthony Tomasic, H&#233;ctor Garc&#237;a-Molina, Kurt Shoens",International Conference on Management of Data,191896
1637,Optimizing queries on files,1994,"Mariano P. Consens, Tova Milo",International Conference on Management of Data,191898
1638,Distributing a search tree among a growing number of processors,1994,"Brigitte Kr&#246;ll, Peter Widmayer",International Conference on Management of Data,191891
1639,Predictive dynamic load balancing of parallel and distributed rule and query processing,1994,"Hasanat M. Dewan, Salvatore J. Stolfo, Mauricio Hern&#225;ndez, Jae-Jun Hwang",International Conference on Management of Data,191893
1640,Sequence query processing,1994,"Praveen Seshadri, Miron Livny, Raghu Ramakrishnan",International Conference on Management of Data,191926
1641,XSB as an efficient deductive database engine,1994,"Konstantinos Sagonas, Terrance Swift, David S. Warren",International Conference on Management of Data,191927
1642,"Self-adaptive, on-line reclustering of complex object data",1994,"William J. McIver, Jr., Roger King",International Conference on Management of Data,191924
1643,Fast subsequence matching in time-series databases,1994,"Christos Faloutsos, M. Ranganathan, Yannis Manolopoulos",International Conference on Management of Data,191925
1644,Shoring up persistent applications,1994,"Michael J. Carey, David J. DeWitt, Michael J. Franklin, Nancy E. Hall, Mark L. McAuliffe, Jeffrey F. Naughton, Daniel T. Schuh, Marvin H. Solomon, C. K. Tan, Odysseas G. Tsatalos, Seth J. White, Michael J. Zwilling",International Conference on Management of Data,191915
1645,QuickStore: a high performance mapped object store,1994,"Seth J. White, David J. DeWitt",International Conference on Management of Data,191919
1646,Fine-grained sharing in a page server OODBMS,1994,"Michael J. Carey, Michael J. Franklin, Markos Zaharioudakis",International Conference on Management of Data,191911
1647,Partition selection policies in object database garbage collection,1994,"Jonathan E. Cook, Alexander L. Wolf, Benjamin G. Zorn",International Conference on Management of Data,191913
1648,METU object-oriented DBMS,1994,"Asuman Dogac, Budak Arpinar, Cem Evrendilek, Cetin Ozkan, Ilker Altintas, Ilker Durusoy, Mehmet Altinel, Tansel Okay, Yuksel Saygin",International Conference on Management of Data,197137
1649,Formal query languages for secure relational databases,1994,"Marianne Winslett, Kenneth Smith, Xiaolei Qian",ACM Transactions on Database Systems (TODS),195675
1650,Declarative updates of relational databases,1995,Weidong Chen,ACM Transactions on Database Systems (TODS),202110
1651,Static analysis techniques for predicting the behavior of active database rules,1995,"Alexander Aiken, Joseph M. Hellerstein, Jennifer Widom",ACM Transactions on Database Systems (TODS),202107
1652,Databases for networks,1994,H. V. Jagadish,International Conference on Management of Data,191991
1653,A survey and critique of advanced transaction models,1994,C. Mohan,International Conference on Management of Data,191990
1654,Bounded ignorance: a technique for increasing concurrency in a replicated system,1994,"Narayanan Krishnakumar, Arthur J. Bernstein",ACM Transactions on Database Systems (TODS),195670
1655,Quorum consensus in nested-transaction systems,1994,"Kenneth J. Goldman, Nancy Lynch",ACM Transactions on Database Systems (TODS),195666
1656,Multigranularity locking in multiple job classes transaction processing system,1995,"Shan-hoi Ng, Sheung-lun Hung",ACM SIGMOD Record,202665
1657,A close look at the IFO data model,1995,Magdy S. Hanna,ACM SIGMOD Record,202664
1658,The third manifesto,1995,"Hugh Darwen, C. J. Date",ACM SIGMOD Record,202667
1659,Implementing deletion in B+-trees,1995,Jan Jannink,ACM SIGMOD Record,202666
1660,Application of OODB and SGML techniques in text database: an electronic dictionary system,1995,Jian Zhang,ACM SIGMOD Record,202661
1661,The INCINERATE data model,1995,H. V. Jagadish,ACM Transactions on Database Systems (TODS),202113
1662,HODFA: an architectural framework for homogenizing heterogeneous legacy databases,1995,"Kamalakar Karlapalem, Qing Li, Chung-Dak Shum",ACM SIGMOD Record,202663
1663,Implementation aspects of an object-oriented DBMS,1995,"Asuman Dogac, Mehmet Altinel, Cetin Ozkan, Ilker Durusoy",ACM SIGMOD Record,202662
1664,MOSAICO-a system for conceptual modeling and rapid prototyping of object-oriented database application,1994,"M. Missikoff, M. Toiati",International Conference on Management of Data,191958
1665,A language based multidatabase system,1994,"Eva K&#252;hn, Thomas Tschernko, Konrad Schwarz",International Conference on Management of Data,191963
1666,Ptool: a scalable persistent object manager,1994,"R. L. Grossman, X. Qin",International Conference on Management of Data,191965
1667,The ORES temporal database management system,1994,"Babis Theodoulidis, Aziz Ait-Braham, George Andrianopoulos, Jayant Chaudhary, George Karvelis, Simon Sou",International Conference on Management of Data,191967
1668,Enterprise information architectures-they're finally changing,1994,Wesley P. Melling,International Conference on Management of Data,191948
1669,Relaxed transaction processing,1994,"Munindar P. Singh, Christine Tomlinson, Darrell Woelk",International Conference on Management of Data,191949
1670,The IMPRESS DDT: a database design toolbox based on a formal specification language,1994,"Jan Flokstra, Maurice van Keulen, Jacek Skowronek",International Conference on Management of Data,191951
1671,The MEDUSA project: autonomous data management in a shared-nothing parallel database machine,1994,"G. M. Bryan, W. E. Moore, B. J. Curry, K. W. Lodge, J. Geyer",International Conference on Management of Data,191955
1672,EOS: an extensible object store,1994,"Alexandros Biliris, Euthimios Panagos",International Conference on Management of Data,191983
1673,The MYRIAD federated database prototype,1994,"S.-Y. Hwang, E.-P. Lim, H.-R. Yang, S. Musukula, K. Mediratta, M. Ganesh, D. Clements, J. Stenoien, J. Srivastava",International Conference on Management of Data,191986
1674,GENESYS: a system for efficient spatial query processing,1994,"Thomas Brinkhoff, Hans-Peter Kriegel, Ralf Schneider, Bernhard Seeger",International Conference on Management of Data,191988
1675,Open object database management systems,1994,Jos&#233; A. Blakeley,International Conference on Management of Data,191989
1676,XSB as a deductive database,1994,"Konstantinos Sagonas, Terrance Swift, David S. Warren",International Conference on Management of Data,191970
1677,Quest: a project on database mining,1994,"R. Agrawal, M. Carey, C. Faloutsos, S. Ghosh, M. Houtsma, T. Imieli&#324;ski, B. Iyer, A. Mahboob, H. Miranda, R. Srikant, A. Swami",International Conference on Management of Data,191972
1678,Query by diagram: a graphical environment for querying databases,1994,"Tiziana Catarci, Giuseppe Santucci",International Conference on Management of Data,191976
1679,DBLearn: a system prototype for knowledge discovery in relational databases,1994,"Jiawei Han, Yongjian Fu, Yue Huang, Yandong Cai, Nick Cercone",International Conference on Management of Data,191979
1680,How to modify SQL queries in order to guarantee sure answers,1994,H.-J. Klein,ACM SIGMOD Record,187445
1681,Research issues in databases for ARCS: Active Rapidly Changing data Systems,1994,Anindya Datta,ACM SIGMOD Record,187442
1682,"Response to the ODMG-93 commentary written by Dr. Won Kim of UniSQL, Inc.",1994,CORPORATE Object Database Management Group,ACM SIGMOD Record,187439
1683,Formal aspects of concurrency control in long-duration transaction systems using the NT/PV model,1994,"Henry F. Korth, Greg Speegle",ACM Transactions on Database Systems (TODS),185854
1684,The impact of database research on industrial products (panel),1994,"Jos&#233; A. Blakeley, Dan Fishman, David Lomet, Michael Stonebraker",ACM SIGMOD Record,187455
1685,Announcement-the temporal query language TSQL2 final language definition,1994,"Richard Thomas Snodgrass, Ilsoo Ahn, Gad Ariav, Don Batory, James Clifford, Curtis E. Dyreson, Ramez Elmasri, Fabio Grandi, Christian S. Jensen, Wolfgang K&#228;fer, Nick Kline, Krishna Kulkarni, T. Y. Cliff Leung, Nikos Lorentzos, John F. Roddick, Arie Segev, Michael D. Soo, Suryanarayana M. Sripada",ACM SIGMOD Record,187454
1686,A TSQL2 tutorial,1994,"Richard Thomas Snodgrass, Ilsoo Ahn, Gad Ariav, Don Batory, James Clifford, Curtis E. Dyreson, Ramez Elmasri, Fabio Grandi, Christian S. Jensen, Wolfgang K&#228;fer, Nick Kline, Krishna Kulkarni, T. Y. Cliff Leung, Nikos Lorentzos, John F. Roddick, Arie Segev, Michael D. Soo, Suryanarayana M. Sripada",ACM SIGMOD Record,187449
1687,Performance evaluation of a new distributed deadlock detection algorithm,1994,"Chim-fu Yeung, Sheung-lun Hung, Kam-yiu Lam",ACM SIGMOD Record,187447
1688,Jumping on the NII bandwagon,1994,Xiaolei Qian,ACM SIGMOD Record,187462
1689,Database research at NTHU and ITRI,1994,Arbee L. P. Chen,ACM SIGMOD Record,187460
1690,Medical information systems: characterization and challenges,1994,"Jorge C. G. Ramirez, Lon A. Smith, Lynn L. Peterson",ACM SIGMOD Record,187458
1691,Research issues in active database systems: report from the closing panel at RIDE-ADS '94,1994,Jennifer Widom,ACM SIGMOD Record,187457
1692,Metadata for multimedia documents,1994,"Klemens B&#246;hm, Thomas C. Rakow",ACM SIGMOD Record,190635
1693,A new join algorithm,1994,"Dong Keun Shin, Arnold Charles Meltzer",ACM SIGMOD Record,190633
1694,Data modelling in the large,1994,Martin Bertram,ACM SIGMOD Record,190631
1695,Are the terms version and variant orthogonal to one another?,1994,Hartmut Wedekind,ACM SIGMOD Record,190628
1696,Supporting dynamic displays using active rules,1994,"Oscar D&#237;az, Arturo Jaime, Norman W. Paton, Ghassan al-Qaimari",ACM SIGMOD Record,181555
1697,Constructing the next 100 database management systems: like the handyman or like the engineer?,1994,"Andreas Geppert, Klaus R. Dittrich",ACM SIGMOD Record,181556
1698,Research perspectives for time series management systems,1994,"Werner Dreyer, Angelika Kotz Dittrich, Duri Schmidt",ACM SIGMOD Record,181553
1699,A hypertext query language for images,1994,Li Yang,ACM SIGMOD Record,181554
1700,TSQL2 language specification,1994,"Richard Thomas Snodgrass, Ilsoo Ahn, Gadi Ariav, Don Batory, James Clifford, Curtis E. Dyreson, Ramez Elmasri, Fabio Grandi, Christian S. Jensen, Wolfgang K&#228;fer, Nick Kline, Krishna Kulkarni, T. Y. Cliff Leung, Nikos Lorentzos, John F. Roddick, Arie Segev, Michael D. Soo, Suryanarayana M. Sripada",ACM SIGMOD Record,181562
1701,Comprehension syntax,1994,"Peter Buneman, Leonid Libkin, Dan Suciu, Val Tannen, Limsoon Wong",ACM SIGMOD Record,181564
1702,Towards an infrastructure for temporal databases: report of an invitational ARPA/NSF workshop,1994,"Niki Pissinou, Richard Thomas Snodgrass, Ramez Elmasri, Inderpal S. Mumick, Tamer &#214;zsu, Barbara Pernici, Arie Segev, Babis Theodoulidis, Umeshwar Dayal",ACM SIGMOD Record,181557
1703,A consensus glossary of temporal database concepts,1994,"Curtis Dyreson, Fabio Grandi, Wolfgang K&#228;fer, Nick Kline, Nikos Lorentzos, Yannis Mitsopoulos, Angelo Montanari, Daniel Nonen, Elisa Peressi, Barbara Pernici, John F. Roddick, Nandlal L. Sarda, Maria Rita Scalas, Arie Segev, Richard Thomas Snodgrass, Mike D. Soo, Abdullah Tansel, Paolo Tiberio, Gio Wiederhold",ACM SIGMOD Record,181560
1704,The database research group at ETH Zurich,1994,"Moira C. Norrie, Stephen M. Blott, Hans-J&#246;rg Schek, Gerhard Weikum",ACM SIGMOD Record,181567
1705,Influencing database language standards,1994,Leonard Gallagher,ACM SIGMOD Record,181568
1706,Text databases: a survey of text models and systems,1994,Arjan Loeffen,ACM SIGMOD Record,181565
1707,Databases for GIS,1994,"Claudia Bauzer Medeiros, Fatima Pires",ACM SIGMOD Record,181566
1708,Evaluation of remote backup algorithms for transaction-processing systems,1994,"Christos A. Polyzois, H&#233;ctor Garc&#237;a-Molina",ACM Transactions on Database Systems (TODS),185836
1709,Synthesis of extended transaction models using ACTA,1994,"Panos K. Chrysanthis, Krithi Ramamritham",ACM Transactions on Database Systems (TODS),185843
1710,Progress on HPCC and NII,1994,Marianne Winslett,ACM SIGMOD Record,181569
1711,Automatic generation of production rules for integrity maintenance,1994,"Stefano Ceri, Piero Fraternali, Stefano Paraboschi, Letizia Tanca",ACM Transactions on Database Systems (TODS),185828
1712,Data modeling of time-based media,1994,"Simon Gibbs, Christian Breiteneder, Dennis Tsichritzis",International Conference on Management of Data,191856
1713,Staggered striping in multimedia information systems,1994,"Steven Berson, Shahram Ghandeharizadeh, Richard Muntz, Xiangyu Ju",International Conference on Management of Data,191852
1714,Combinatorial pattern discovery for scientific data: some preliminary results,1994,"Jason Tsong-Li Wang, Gung-Wei Chirn, Thomas G. Marr, Bruce Shapiro, Dennis Shasha, Kaizhong Zhang",International Conference on Management of Data,191863
1715,Implementation of magic-sets in a relational database system,1994,"Inderpal Singh Mumick, Hamid Pirahesh",International Conference on Management of Data,191860
1716,Incomplete path expressions and their disambiguation,1994,"Yannis E. Ioannidis, Yezdi Lashkari",International Conference on Management of Data,191870
1717,The effectiveness of GIOSS for the text database discovery problem,1994,"Luis Gravano, H&#233;ctor Garc&#237;a-Molina, Anthony Tomasic",International Conference on Management of Data,191869
1718,Adaptive selectivity estimation using query feedback,1994,"Chungmin Melvin Chen, Nick Roussopoulos",International Conference on Management of Data,191874
1719,Optimization of dynamic query evaluation plans,1994,"Richard L. Cole, Goetz Graefe",International Conference on Management of Data,191872
1720,On parallel execution of multiple pipelined hash joins,1994,"Hui-I Hsiao, Ming-Syan Chen, Philip S. Yu",International Conference on Management of Data,191879
1721,Estimating page fetches for index scans with finite LRU buffers,1994,"Arun Swami, K. Bernhard Schiefer",International Conference on Management of Data,191877
1722,Spatial joins using seeded trees,1994,"Ming-Ling Lo, Chinya V. Ravishankar",International Conference on Management of Data,191881
1723,Multi-step processing of spatial joins,1994,"Thomas Brinkhoff, Hans-Peter Kriegel, Ralf Schneider, Bernhard Seeger",International Conference on Management of Data,191880
1724,AlphaSort: a RISC machine sort,1994,"Chris Nyberg, Tom Barclay, Zarka Cvetanovic, Jim Gray, Dave Lomet",International Conference on Management of Data,191884
1725,Managing memory for real-time queries,1994,"Hwee Hwa Pang, Michael J. Carey, Miron Livny",International Conference on Management of Data,191882
1726,Distributed file organization with scalable cost/performance,1994,"Radek Vingralek, Yuri Breitbart, Gerhard Weikum",International Conference on Management of Data,191889
1727,Quickly generating billion-record synthetic databases,1994,"Jim Gray, Prakash Sundaresan, Susanne Englert, Ken Baclawski, Peter J. Weinberger",International Conference on Management of Data,191886
1728,Metadata in video databases,1994,"Ramesh Jain, Arun Hampapur",ACM SIGMOD Record,190638
1729,A metadatabase system for semantic image search by a mathematical model of meaning,1994,"Yasushi Kiyoki, Takashi Kitagawa, Takanari Hayama",ACM SIGMOD Record,190639
1730,Sequoia 2000 metadata schema for satellite images,1994,"Jean T. Anderson, Michael Stonebraker",ACM SIGMOD Record,190642
1731,Using metadata for the intelligent browsing of structured media objects,1994,"William I. Grosky, Farshad Fotouhi, Ishwar K. Sethi, Bogdan Capatina",ACM SIGMOD Record,190644
1732,Metadata for integrating speech documents in a text retrieval system,1994,"Ulrike Glavitsch, Peter Sch&#228;uble, Martin Wechsler",ACM SIGMOD Record,190645
1733,Metadata for mixed-media access,1994,"Francine Chen, Marti Hearst, Julian Kupiec, Jan Pedersen, Lynn Wilcox",ACM SIGMOD Record,190646
1734,Loading databases using dataflow parallelism,1994,"Tom Barclay, Robert Barnes, Jim Gray, Prakash Sundaresan",ACM SIGMOD Record,190647
1735,Recent design trade-offs in SQL3,1994,"Nelson Mattos, Linda G. DeMichiel",ACM SIGMOD Record,190648
1736,Unix RDBMS: the next generation what are the Unix relational-database vendors doing to survive in the next generation of client/server environments,1994,Bill Rosenblatt,ACM SIGMOD Record,190649
1737,Sleepers and workaholics: caching strategies in mobile environments,1994,"Daniel Barbar&#225;, Tomasz Imieli&#324;ski",International Conference on Management of Data,191844
1738,Data replication for mobile computers,1994,"Yixiu Huang, Prasad Sistla, Ouri Wolfson",International Conference on Management of Data,191845
1739,Energy efficient indexing on air,1994,"Tomasz Imielinski, S. Viswanathan, B. R. Badrinath",International Conference on Management of Data,191846
1740,SIGMOD challenges paper: database issues in telecommunications network management,1994,Ilsoo Ahn,International Conference on Management of Data,191847
1741,ASSET: a system for supporting extended transactions,1994,"A. Biliris, S. Dar, N. Gehani, H. V. Jagadish, K. Ramamritham",International Conference on Management of Data,191848
1742,ARIES/CSA: a method for database recovery in client-server architectures,1994,"C. Mohan, Inderpal Narang",International Conference on Management of Data,191849
1743,Ensuring relaxed atomicity for flexible transactions in multidatabase systems,1994,"Aidong Zhang, Marian Nodine, Bharat Bhargava, Omran Bukhres",International Conference on Management of Data,191850
1744,Virtual database technology,1997,"Ashish Gupta, Venky Harinarayan, Anand Rajaraman",ACM SIGMOD Record,271093
1745,Research issues in federated database systems: report of EFDBS '97 workshop,1997,"S. Conrad, B. Eaglestone, W. Hasselbring, M. Roantree, M. Sch&#246;hoff, M. Str&#228;ssler, M. Vermeer, F. Saltor",ACM SIGMOD Record,271089
1746,Information systems research at George Mason University,1997,"Sushil Jajodia, Daniel Barbar&#225;, Alex Brodsky, Larry Kerschberg, Ami Motro, Edgar Sibley, X. Sean Wang",ACM SIGMOD Record,271095
1747,"The five-minute rule ten years later, and other computer storage rules of thumb",1997,"Jim Gray, Goetz Graefe",ACM SIGMOD Record,271094
1748,Extracting entity profiles from semistructured information spaces,1997,"Robert A. Nado, Scott B. Huffman",ACM SIGMOD Record,271083
1749,Integrating dynamically-fetched external information into a DBMS for semistructured data,1997,"Jason McHugh, Jennifer Widom",ACM SIGMOD Record,271082
1750,Workshop on workflow management in scientific and engineering applications-report,1997,"R. McClatchey, G. Vossen",ACM SIGMOD Record,271087
1751,Inferring structure in semistructured data,1997,"Svetlozer Nestorov, Serge Abiteboul, Rajeev Motwani",ACM SIGMOD Record,271084
1752,Management of semistructured data,1997,Dan Suciu,ACM SIGMOD Record,271077
1753,"Research in databases and data-intensive applications: Computer Science Dept. and FIZ, University of Karlsruhe",1997,"Brigitta K&#246;nig-Ries, Peter C. Lockermann",ACM SIGMOD Record,262771
1754,Semistructured and structured data in the Web: going back and forth,1997,"Paolo Atzeni, Giansalvatore Mecca, Paolo Merialdo",ACM SIGMOD Record,271080
1755,Wrapper generation for semi-structured Internet sources,1997,"Naveen Ashish, Craig A. Knoblock",ACM SIGMOD Record,271078
1756,Database systems-breaking out of the box,1997,"Avi Silberschatz, Stan Zdonik",ACM SIGMOD Record,262768
1757,Asserting beliefs in MLS relational models,1997,"Nenad A. Jukic, Susan V. Vrbsky",ACM SIGMOD Record,262767
1758,Lore: a database management system for semistructured data,1997,"Jason McHugh, Serge Abiteboul, Roy Goldman, Dallas Quass, Jennifer Widom",ACM SIGMOD Record,262770
1759,Report on DART '96: databases: active and real-time (concepts meet practice),1997,"Krithi Ramamritham, Nandit Soparkar",ACM SIGMOD Record,262769
1760,Where will object technology drive data administration?,1998,Arnon Rosenthal,ACM SIGMOD Record,273270
1761,Repositories and object oriented databases,1998,Philip A. Bernstein,ACM SIGMOD Record,273271
1762,Towards on-line analytical mining in large databases,1998,Jiawei Han,ACM SIGMOD Record,273273
1763,Intelligent access to heterogeneous information sources: report on the 4th workshop on knowledge representation meets databases,1997,"Franz Baader, Manfred A. Jeusfeld, Werner Nutt",ACM SIGMOD Record,274461
1764,An extensible notation for spatiotemporal index queries,1998,"Vassilis J. Tsotras, Christian S. Jensen, Richard Thomas Snodgrass",ACM SIGMOD Record,273258
1765,T2: a customizable parallel database for multi-dimensional data,1998,"Chialin Chang, Anurag Acharya, Alan Sussman, Joel Saltz",ACM SIGMOD Record,273264
1766,Workflow history management,1998,"Pinar Koksal, Sena Nural Arpinar, Asuman Dogac",ACM SIGMOD Record,273265
1767,Towards a richer Web object model,1998,Frank Manola,ACM SIGMOD Record,273267
1768,Materialized views and data warehouses,1998,Nick Roussopoulos,ACM SIGMOD Record,273253
1769,Applications of JAVA programming language to database management,1998,"Bradley F. Burton, Victor W. Marek",ACM SIGMOD Record,273254
1770,Unbundling active functionality,1998,"Stella Gatziu, Arne Koschel, G&#252;nter von B&#252;ltzingsloewen, Hans Fritschi",ACM SIGMOD Record,273255
1771,Mining fuzzy association rules in databases,1998,"Chan Man Kuok, Ada Fu, Man Hon Wong",ACM SIGMOD Record,273257
1772,The database and information system research group at the University of ULM,1997,"Peter Dadam, Wolfgang Klas",ACM SIGMOD Record,271096
1773,Workshop report on experiences using object data management in the real-world,1998,Akmal B. Chaudhri,ACM SIGMOD Record,273247
1774,Report on the second IEEE metadata conference (Metadata '97),1998,"Ron Musick, Chris Miller",ACM SIGMOD Record,273249
1775,PREDATOR: a resource for database research,1998,Praveen Seshadri,ACM SIGMOD Record,273251
1776,Your mediators need data conversion!,1998,"Sophie Cluet, Claude Delobel, J&#233;r&#466;me Sim&#233;on, Katarzyna Smaga",International Conference on Management of Data,276321
1777,Dimensionality reduction for similarity searching in dynamic databases,1998,"K. V. Ravi Kanth, Divyakant Agrawal, Ambuj Singh",International Conference on Management of Data,276320
1778,Optimal multi-step k-nearest neighbor search,1998,"Thomas Seidl, Hans-Peter Kriegel",International Conference on Management of Data,276319
1779,The pyramid-technique: towards breaking the curse of dimensionality,1998,"Stefan Berchtold, Christian B&#246;hm, Hans-Peter Kriegal",International Conference on Management of Data,276318
1780,Cost-based query scrambling for initial delays,1998,"Tolga Urhan, Michael J. Franklin, Laurent Amsaleg",International Conference on Management of Data,276317
1781,Interaction of query evaluation and buffer management for information retrieval,1998,"Bj&#246;rn T. J&#243;nsson, Michael J. Franklin, Divesh Srivastava",International Conference on Management of Data,276316
1782,Efficient mid-query re-optimization of sub-optimal query execution plans,1998,"Navin Kabra, David J. DeWitt",International Conference on Management of Data,276315
1783,Automatic subspace clustering of high dimensional data for data mining applications,1998,"Rakesh Agrawal, Johannes Gehrke, Dimitrios Gunopulos, Prabhakar Raghavan",International Conference on Management of Data,276314
1784,Efficiently mining long patterns from databases,1998,"Roberto J. Bayardo, Jr.",International Conference on Management of Data,276313
1785,CURE: an efficient clustering algorithm for large databases,1998,"Sudipto Guha, Rajeev Rastogi, Kyuseok Shim",International Conference on Management of Data,276312
1786,Changing the rules: transformations for rule-based optimizers,1998,"Mitch Cherniack, Stan Zdonik",International Conference on Management of Data,276311
1787,Query unnesting in object-oriented databases,1998,Leonidas Fegaras,International Conference on Management of Data,276310
1788,Reusing invariants: a new strategy for correlated queries,1998,"Jun Rao, Kenneth A. Ross",International Conference on Management of Data,276309
1789,Parallel mining algorithms for generalized association rules with classification hierarchy,1998,"Takahiko Shintani, Masaru Kitsuregawa",International Conference on Management of Data,276308
1790,Exploratory mining and pruning optimizations of constrained associations rules,1998,"Raymond T. Ng, Laks V. S. Lakshmanan, Jiawei Han, Alex Pang",International Conference on Management of Data,276307
1791,Query flocks: a generalization of association-rule mining,1998,"Dick Tsur, Jeffrey D. Ullman, Serge Abiteboul, Chris Clifton, Rajeev Motwani, Svetlozar Nestorov, Arnon Rosenthal",International Conference on Management of Data,276306
1792,Bitmap index design and evaluation,1998,"Chee-Yong Chan, Yannis E. Ioannidis",International Conference on Management of Data,276336
